npi,provider_name,entity_type,taxonomy_description,city,state
1619051810,SHRIVER NURSING SERVICES  INC,NPI-2,Nursing Care,WESTBOROUGH,MA
1619148277,NFI NORTH  INC,NPI-2,Voluntary or Charitable,CONTOOCOOK,NH
1619171923,BECKET ACADEMY INC.,NPI-2,Residential Treatment Facility  Emotionally Disturbed Children,BELGRADE,ME
1619255841,EASTER SEALS SOUTHERN CALIFORNIA  INC,NPI-2,Behavior Analyst,IRVINE,CA
1619341716,NYU LANGONE HOSPITALS,NPI-2,General Acute Care Hospital,BROOKLYN,NY
1619368842,COMMUNITY CARE HEALTH NETWORK LLC,NPI-2,Nurse Practitioner,NASHVILLE,TN
1619400058,SPECIALTY HOME CARE LLC,NPI-2,Respite Care,WASHINGTON,DC
1619683687,FAMILY BOND TREATMENT CENTER LLC,NPI-2,Community/Behavioral Health,PHOENIX,AZ
1619908985,PEDIATRIC SERVICES OF AMERICA  LLC,NPI-2,Nursing Care,BROCKTON,MA
1619923604,EGAN HEALTHCARE CORPORATION,NPI-2,Home Health,LA PLACE,LA
1619969458,SUN RIVER HEALTH INC.,NPI-2,Clinic/Center  Federally Qualified Health Center (FQHC),PEEKSKILL,NY
1629079009,NORTHEAST VALLEY HEALTH CORPORATION,NPI-2,Clinic/Center  Federally Qualified Health Center (FQHC),VAN NUYS,CA
1629134663,GREEN RIVER REGIONAL MENTAL HEALTH/MENTAL RETARDATION BOARD  INC.,NPI-2,Clinic/Center  Developmental Disabilities,OWENSBORO,KY
1629138995,COUNTY OF OUTAGAMIE,NPI-2,Clinic/Center  Mental Health (Including Community Mental Health Center),APPLETON,WI
1629249826,ABILITY CARE PARTNERS INCORPORATED,NPI-2,Home Health,CRYSTAL,MN
1629283197,ALTAMED HEALTH SERVICES CORP.,NPI-2,Clinic/Center  Federally Qualified Health Center (FQHC),LOS ANGELES,CA
1629370713,OFFICE OF THE STATE SUPERINTENDENT OF EDUCATION,NPI-2,Bus,WASHINGTON,DC
1629407069,EXACT SCIENCES LABORATORIES  LLC,NPI-2,Clinical Medical Laboratory,MADISON,WI
1629560198,TRAUMA AND RECOVERY CENTERS,NPI-2,Counselor  Mental Health,SILVER CITY,NM
1629720081,AVENUES RECOVERY CENTER AT COVINGTON,NPI-2,Substance Abuse Rehabilitation Facility,COVINGTON,LA
1629780432,ADONAI OUTPATIENT TREATMENT CENTER LLC.,NPI-2,Clinic/Center  Mental Health (Including Community Mental Health Center),PHOENIX,AZ
1639102882,SOUTHCENTRAL FOUNDATION,NPI-2,Community Based Residential Treatment Facility  Mental Illness,ANCHORAGE,AK
1639134463,MAXIM HEALTHCARE SERVICES  INC.,NPI-2,Home Health,COLUMBUS,OH
1639138480,SALTZMAN  TANIS  PITTELL  LEVIN AND JACOBSON,NPI-2,Pediatrics,HOLLYWOOD,FL
1639176522,VISITING NURSE GROUP  INC,NPI-2,Home Health,PHILADELPHIA,PA
1639204316,RHA HEALTH SERVICES NC  LLC,NPI-2,Day Training  Developmentally Disabled Services,ASHEVILLE,NC
1639240971,DEPAUL COMMUNITY RESOURCES,NPI-2,Foster Care Agency,ROANOKE,VA
1639287667,COMMUNITY INTERVENTION ASSOCIATES,NPI-2,Community/Behavioral Health,YUMA,AZ
1639476617,MENTOR ABI,NPI-2,Community Based Residential Treatment Facility  Intellectual and/or Developmental Disabilities,CHARLESTOWN,RI
1639681463,INSPIRED BEHAVIORAL HEALTH  INC.,NPI-2,Community Based Residential Treatment Facility  Mental Illness,RAYMONDVILLE,TX
1649280140,BUILDING BRIDGES DEVELOPMENTAL AND COMMUNITY SERVICES,NPI-2,Clinic/Center  Developmental Disabilities,LONOKE,AR
1649293028,COMMUNITY HEALTHLINK INC,NPI-2,Clinic/Center  Mental Health (Including Community Mental Health Center),WORCESTER,MA
1649307398,SUNSHINE SCHOOL & DEVELOPMENT CENTER,NPI-2,Day Training  Developmentally Disabled Services,ROGERS,AR
1649363342,AMERICARE  INC.,NPI-2,Home Health,BROOKLYN,NY
1649391756,ST. FRANCIS AREA DEVELOPMENTAL CENTER,NPI-2,Day Training  Developmentally Disabled Services,FORREST CITY,AR
1649396078,WESTERN KY REGIONAL MHMR BOARD INC,NPI-2,Clinic/Center  Mental Health (Including Community Mental Health Center),PADUCAH,KY
1649495110,WAYPOINT MAINE  INC.,NPI-2,Case Management,SANFORD,ME
1649681362,PATRIOT HOME CARE  INC,NPI-2,Home Health,PHILADELPHIA,PA
1649937236,TANGELO - INTEND  INC.,NPI-2,Medical Foods Supplier,BIRMINGHAM,MI
1659315430,COUNTY OF SANTA CRUZ,NPI-2,Clinic/Center,SANTA CRUZ,CA
1659330686,HELEN ROSS MCNABB CENTER,NPI-2,Clinic/Center  Mental Health (Including Community Mental Health Center),KNOXVILLE,TN
1659347623,CHOCTAW NATION OF OKLAHOMA,NPI-2,General Acute Care Hospital  Rural,TALIHINA,OK
1659402303,ALAMEDA COUNTY BEHAVIORAL HEALTH CARE,NPI-2,Community/Behavioral Health,OAKLAND,CA
1659406296,VERMONT DEPARTMENT OF MENTAL HEALTH,NPI-2,Clinic/Center  Adult Mental Health,BURLINGTON,VT
1659601979,NORTHEAST PENNSYLVANIA CENTER FOR INDEPENDENT LIVING,NPI-2,Supports Brokerage,SCRANTON,PA
1659629301,AT HOME CARE ST. LOUIS CDS,NPI-2,In Home Supportive Care,BRIDGETON,MO
1659769446,BRIGHTVIEW  LLC,NPI-2,Internal Medicine  Addiction Medicine,CINCINNATI,OH
1659913978,CARSON CITY COMMUNITY COUNSELING CENTER,NPI-2,Community/Behavioral Health,CARSON CITY,NV
1659961639,NEW DIRECTION BEHAVIORAL HEALTH,NPI-2,Clinic/Center  Mental Health (Including Community Mental Health Center),PHOENIX,AZ
1669017653,BEHAVIORAL HEALTH NETWORK  INC,NPI-2,Clinic/Center  Methadone Clinic,SPRINGFIELD,MA
1669065892,VDA COMMUNITY CENTER CORP,NPI-2,Clinic/Center  Mental Health (Including Community Mental Health Center),MIAMI,FL
1669431524,NORTH RANGE BEHAVIORAL HEALTH,NPI-2,Clinic/Center  Mental Health (Including Community Mental Health Center),GREELEY,CO
1669462420,ST JOSEPHS UNIVERSITY MEDICAL CENTER INC.,NPI-2,General Acute Care Hospital,PATERSON,NJ
1669508537,NORTHWEST INDIAN TREATMENT CENTER,NPI-2,Clinic/Center,SHELTON,WA
1669557989,HERITAGE HOUSE OF VIRGINIA  INC.,NPI-2,Residential Treatment Facility  Intellectual and/or Developmental Disabilities,STAFFORD,VA
1669566576,STATE OF OKLAHOMA DEPT. OF HUMAN SERVICES,NPI-2,Community/Behavioral Health,OKLAHOMA CITY,OK
1669612651,CHESAPEAKE REHAB EQUIPMENT INC,NPI-2,Durable Medical Equipment & Medical Supplies  Customized Equipment,ASHLAND,VA
1669878914,HAMASPIK OF ORANGE COUNTY,NPI-2,Voluntary or Charitable,MONROE,NY
1669982237,WELLSPACE HEALTH,NPI-2,Clinic/Center  Dental,GALT,CA
1669988929,CARE CONNECT CDPAP INC,NPI-2,Home Health,BROOKLYN,NY
1679236756,CINQ-NY HEALTH HOME IPA  LLC,NPI-2,Clinic/Center  Multi-Specialty,BUFFALO,NY
1679279046,FISHING POINT HEALTH CARE LLC,NPI-2,General Practice,PORTSMOUTH,VA
1679504864,KENNEBEC VALLEY MENTAL HEALTH CENTER,NPI-2,Clinic/Center  Mental Health (Including Community Mental Health Center),WATERVILLE,ME
1679525919,THE CLEVELAND CLINIC FOUNDATION,NPI-2,General Acute Care Hospital,CLEVELAND,OH
1679560502,GOLD CROSS SERVICES  INC.,NPI-2,Ambulance  Land Transport,SALT LAKE CITY,UT
1679570113,NORTHEAST ARC INC,NPI-2,Home Health,DANVERS,MA
1679570980,LOS ANGELES UNIFIED SCHOOL DISTRICT,NPI-2,Social Worker  School,LOS ANGELES,CA
1679573083,BLYTHEDALE CHILDREN'S HOSPITAL,NPI-2,Rehabilitation Hospital  Children,VALHALLA,NY
1679602502,COMMONWEALTH OF MASSACHUSETTS,NPI-2,Case Management,WAKEFIELD,MA
1679743496,INDEPENDENT LIVING INC,NPI-2,Home Health,BATON ROUGE,LA
1679970891,NORTH SHORE LIJ  URGENT CARE  P.C.,NPI-2,Clinic/Center  Urgent Care,ROCKVILLE CENTRE,NY
1689048340,LOREN COOKE,NPI-1,Non-emergency Medical Transport (VAN),FT WINGATE,NM
1689067563,GARDEN STATE REHAB SERVICES,NPI-2,Clinic/Center  Rehabilitation,ELMWOOD PARK,NJ
1689226599,MEDLIGHT HOSPICE INC.,NPI-2,Hospice Care  Community Based,ENCINO,CA
1689375230,FULL CIRCLE HEALTH NETWORK,NPI-2,Supports Brokerage,SACRAMENTO,CA
1689606196,SOUTHERN CALIFORNIA PERMANENTE MEDICAL GROUP,NPI-2,Health Maintenance Organization,FONTANA,CA
1689608150,UNIVERSITY OF CALIFORNIA IRVINE,NPI-2,General Acute Care Hospital,ORANGE,CA
1689621468,BEHAVIORAL HEALTH SERVICES NORTH  INC.,NPI-2,Clinic/Center  Mental Health (Including Community Mental Health Center),MORRISONVILLE,NY
1689682932,TEXAS HOME HEALTH OF AMERICA  L.P.,NPI-2,Home Health,DALLAS,TX
1689742439,MOSAIC,NPI-2,Community Based Residential Treatment Facility  Mental Illness,NEWARK,DE
1689747552,UNM HOSPITAL,NPI-2,General Acute Care Hospital,ALBUQUERQUE,NM
1689769911,DIGNITY HEALTH,NPI-2,General Acute Care Hospital,SAN BERNARDINO,CA
1689811465,LIVING INNOVATIONS SUPPORT SERVICES LLC,NPI-2,Day Training  Developmentally Disabled Services,CASCO,ME
1689827321,PROVIDENCE HEALTH & SERVICES - WASHINGTON,NPI-2,Hospice Care  Community Based,SEATTLE,WA
1689894701,HELPING HANDS OF NEW ORLEANS,NPI-2,Home Health,KENNER,LA
1689950248,SAN JOSE FOOTHILL FAMILY COMMUNITY CLINIC  INC.,NPI-2,Clinic/Center  Federally Qualified Health Center (FQHC),SAN JOSE,CA
1699088070,GREENVILLE COUNTY DISABILITIES AND SPECIAL NEEDS BOARD,NPI-2,Community Based Residential Treatment Facility  Intellectual and/or Developmental Disabilities,GREENVILLE,SC
1699135939,PETTIS COUNTY BOARD OF SERVICES FOR THE DEVELOPMENTALLY DISABLED,NPI-2,Case Management,SEDALIA,MO
1699167585,RAINBOW CHILDREN'S MEDICAL DAY CARE LLC,NPI-2,Clinic/Center  Medically Fragile Infants and Children Day Care,MERCERVILLE,NJ
1699280768,KEYSTONE COMMUNITY RESOURCES  INC.,NPI-2,Community Based Residential Treatment Facility  Intellectual and/or Developmental Disabilities,PHILLIPSBURG,NJ
1699356683,TULALIP TRIBES OF WASHINGTON QUIL CEDA CREEK COUNSELING,NPI-2,Clinic/Center  Methadone Clinic,TULALIP,WA
1699700971,HARBINDER BRAR,NPI-1,Obstetrics & Gynecology  Maternal & Fetal Medicine,RIVERSIDE,CA
1699812404,GREATER UNITY ADULT SERVICES,NPI-2,Clinic/Center  Adult Day Care,NORTH CHESTERFIELD,VA
1699828970,ALABAMA DEPARTMENT OF MENTAL HEALTH AND MENTAL RETARDATION,NPI-2,Community/Behavioral Health,MONTGOMERY,AL
1699896316,REM COMMUNITY OPTIONS  INC.,NPI-2,Community/Behavioral Health,BENWOOD,WV
1699986034,PACIFIC HEALTH SERVICES  INC.,NPI-2,Home Health,LOS ANGELES,CA
1699986687,KENAITZE INDIAN TRIBE,NPI-2,Community/Behavioral Health,KENAI,AK
1700037900,STAR HOME HEALTH SERVICES INC,NPI-2,Home Health,CHICAGO,IL
1700090834,LOS ANGELES COUNTY DEPARTMENT OF PUBLIC HEALTH,NPI-2,Public Health or Welfare,ALHAMBRA,CA
1700120888,HAMASPIK OF KINGS COUNTY  INC.,NPI-2,Case Management,BROOKLYN,NY
1700172392,EXTENDED FAMILY CARE LLC,NPI-2,Community/Behavioral Health,MANCHESTER,TN
1700210200,COUNTY OF KERN,NPI-2,Psychiatric Hospital,BAKERSFIELD,CA
1700280971,PREMIER BIOTECH LABS  LLC,NPI-2,Clinical Medical Laboratory,MINNEAPOLIS,MN
1700553856,SOUTHERN BAPTIST HOSPITAL OF FLORIDA  INC,NPI-2,General Acute Care Hospital  Children,JACKSONVILLE,FL
1700803392,NASSAU HEALTH CARE CORPORATION,NPI-2,Clinic/Center  End-Stage Renal Disease (ESRD) Treatment,UNIONDALE,NY
1700828852,THE METROHEALTH SYSTEM,NPI-2,General Acute Care Hospital,CLEVELAND,OH
1700925351,MULTICARE HEALTH SYSTEM,NPI-2,Community/Behavioral Health,PUYALLUP,WA
1700947298,GATEWAYS COMMUNITY SERVICES,NPI-2,Early Intervention Provider Agency,NASHUA,NH
1700955028,NORTHERN HUMAN SERVICES,NPI-2,Clinic/Center  Mental Health (Including Community Mental Health Center),CONWAY,NH
1700961646,CHRYSALIS CENTER  LLC,NPI-2,Community/Behavioral Health,FORT LAUDERDALE,FL
1710008628,ST. JOHN'S COMMUNITY SERVICES,NPI-2,Point of Service,BARTLETT,TN
1710045364,THE HOME FOR LITTLE WANDERERS,NPI-2,Clinic/Center  Adolescent and Children Mental Health,ROSLINDALE,MA
1710116116,KAISER FOUNDATION HOSPITALS,NPI-2,General Acute Care Hospital,VACAVILLE,CA
1710312368,CONNECTICUT ADDICTION MEDICINE  LLC,NPI-2,Psychiatry & Neurology  Addiction Psychiatry,ROCKY HILL,CT
1710322094,FIRST STEP ARKANSAS  LLC,NPI-2,Clinic/Center  Developmental Disabilities,PARAGOULD,AR
1710332184,CARE ADVANTAGE  INC,NPI-2,Home Health,NORTH CHESTERFIELD,VA
1710554571,USRC PEARLRIDGE  LLC,NPI-2,Clinic/Center  End-Stage Renal Disease (ESRD) Treatment,AIEA,HI
1710901939,WASHINGTON COUNTY MENTAL HEALTH SERVICES  INC.,NPI-2,Clinic/Center  Developmental Disabilities,BARRE,VT
1720010549,ADAPT,NPI-2,Counselor  Addiction (Substance Use Disorder),ROSEBURG,OR
1720011810,BANNER DESERT MEDICAL CENTER,NPI-2,General Acute Care Hospital,MESA,AZ
1720049190,RISE  INC,NPI-2,Voluntary or Charitable,BOISE,ID
1720075104,MERCY LIFE CENTER CORPORATION,NPI-2,Public Health or Welfare,PITTSBURGH,PA
1720121106,BANCROFT  A NEW JERSEY NONPROFIT CORPORATION,NPI-2,Clinic/Center  Rehabilitation,CHERRY HILL,NJ
1720125115,NORTH METRO COMMUNITY SERVICES  INC.,NPI-2,Day Training  Developmentally Disabled Services,WESTMINSTER,CO
1720145378,ACUMEN FISCAL AGENT LLC,NPI-2,Community/Behavioral Health,MESA,AZ
1720271836,PSI SERVICES III  INC,NPI-2,Clinic/Center  Mental Health (Including Community Mental Health Center),WASHINGTON,DC
1720281264,MOUNT PROSPECT ACADEMY  INC.,NPI-2,Residential Treatment Facility  Emotionally Disturbed Children,PLYMOUTH,NH
1720480627,CHILDREN'S HEALTH SYSTEM OF TEXAS,NPI-2,General Acute Care Hospital  Children,PLANO,TX
1720489453,NEO NATAL ASSOCIATES PLC,NPI-2,Pediatrics  Neonatal-Perinatal Medicine,GRAND RAPIDS,MI
1720560030,MOSAIC SENIOR SERVICES  INC,NPI-2,In Home Supportive Care,TUCSON,AZ
1720638208,DEL DIOS CARE  LLC,NPI-2,Assisted Living Facility,ESCONDIDO,CA
1720716608,MOTHERLAND COUNSELING  LLC,NPI-2,Community/Behavioral Health,PHOENIX,AZ
1730132234,MEMORIAL HERMANN HEALTH SYSTEM,NPI-2,General Acute Care Hospital,HOUSTON,TX
1730136201,COMPASS HEALTH,NPI-2,Community/Behavioral Health,EVERETT,WA
1730178864,PINNACLE REGIONAL HOSPITAL  LLC,NPI-2,General Acute Care Hospital,BOONVILLE,MO
1730205675,RENAISSANCE COMMUNITY HOMES,NPI-2,Community Based Residential Treatment Facility  Mental Illness,ADRIAN,MI
1730218868,COUNSELING SERVICE OF ADDISON COUNTY,NPI-2,Clinic/Center  Developmental Disabilities,MIDDLEBURY,VT
1730219353,DERMOTT DAY SERVICE CENTER  INC.,NPI-2,Day Training  Developmentally Disabled Services,DERMOTT,AR
1730244294,BESTCARE  INC,NPI-2,Home Health,LEVITTOWN,NY
1730302829,DEPARTMENT OF DEVELOPMENTAL SERVICES,NPI-2,Case Management,NORTHAMPTON,MA
1730350430,HOPE ENTERPRISES  INC.,NPI-2,Voluntary or Charitable,WILLIAMSPORT,PA
1730366824,HEALTH CONNECT AMERICA  INC,NPI-2,Community/Behavioral Health,FRANKLIN,TN
1730369760,HUMAN CARE SERVICES FOR FAMILIES AND CHILDREN INC,NPI-2,Community Based Residential Treatment Facility  Intellectual and/or Developmental Disabilities,BROOKLYN,NY
1730391368,FAMILY & CHILDREN'S SERVICES  INC,NPI-2,Community/Behavioral Health,TULSA,OK
1730431933,THE CENTER FOR FAMILY SUPPORT  NEW JERSEY  INC.,NPI-2,Community Based Residential Treatment Facility  Intellectual and/or Developmental Disabilities,PARAMUS,NJ
1730438706,HUMAN CARE LLC,NPI-2,Home Health,BROOKLYN,NY
1730451071,COORDINATED BEHAVIORAL CARE  INC,NPI-2,Case Management,NEW YORK,NY
1730491945,CITY MEDICAL OF UPPER EAST SIDE  PLLC,NPI-2,Clinic/Center  Urgent Care,NEW YORK,NY
1730527540,KIDS UNLIMITED LEARNING ACADEMY,NPI-2,Clinic/Center  Rehabilitation,SEARCY,AR
1730615717,INNOVATIVE LIFESTYLES  INC,NPI-2,Community Based Residential Treatment Facility  Intellectual and/or Developmental Disabilities,WATERFORD,MI
1730804972,AFFIRMED WELLNESS LLC,NPI-2,Community/Behavioral Health,TEMPE,AZ
1740209881,NORTH SUFFOLK COMMUNITY SERVICES INC.,NPI-2,Clinic/Center,EAST BOSTON,MA
1740221621,LIBERTY DIALYSIS - HAWAII LLC,NPI-2,Clinic/Center  End-Stage Renal Disease (ESRD) Treatment,HONOLULU,HI
1740288505,UVALDE COUNTY HOSPITAL AUTHORITY,NPI-2,General Acute Care Hospital  Critical Access,UVALDE,TX
1740316561,PYRA MED HEALTH SERVICES  LLC,NPI-2,Home Health,SAN ANTONIO,TX
1740339381,SYSTEMS UNLIMITED  INC.,NPI-2,Day Training  Developmentally Disabled Services,IOWA CITY,IA
1740376292,NEW MEXICO CONSUMER DIRECT PERSONAL CARE  LLC,NPI-2,Home Health,ALBUQUERQUE,NM
1740554229,GREATER ROCHESTER HEALTH HOME NETWORK  LLC,NPI-2,Case Management,ROCHESTER,NY
1740586205,BALTIMORE CITY SCHOOLS,NPI-2,Local Education Agency (LEA),BALTIMORE,MD
1740604453,ORANGEBURG CO. DSN BOARD,NPI-2,Public Health or Welfare,ORANGEBURG,SC
1740663483,REAL CARE  INC.,NPI-2,Community Based Residential Treatment Facility  Intellectual and/or Developmental Disabilities,WHEAT RIDGE,CO
1740845940,FLORENCE COUNTY DISABILITIES AND SPECIAL NEEDS BOARD,NPI-2,Early Intervention Provider Agency,FLORENCE,SC
1750053948,SRH CHN LEAD HEALTH HOME LLC,NPI-2,Case Management,PEEKSKILL,NY
1750304044,KEYSTONE CONTINUUM  LLC,NPI-2,Psychiatric Residential Treatment Facility,MOUNTAIN CITY,TN
1750354528,CENTRAL PIERCE FIRE & RESCUE,NPI-2,Ambulance  Land Transport,TACOMA,WA
1750354619,REGIONCARE INC.,NPI-2,Home Health,GARDEN CITY,NY
1750408514,COUNTY OF PLACER,NPI-2,Community/Behavioral Health,AUBURN,CA
1750421921,VOLUNTEERS OF AMERICA TEXAS  INC.,NPI-2,Intermediate Care Facility  Intellectual Disabilities,EULESS,TX
1750425955,BEST NURSING CARE  INC.,NPI-2,Home Health,GROVEPORT,OH
1750459772,RESIDENTIAL OPPORTUNITIES  INC.,NPI-2,Residential Treatment Facility  Intellectual and/or Developmental Disabilities,KALAMAZOO,MI
1750477766,NEW ENGLAND HOME HEALTH SERVICES  INC.,NPI-2,Home Health,LEXINGTON,MA
1750542585,HBA MANAGEMENT INC,NPI-2,Clinic/Center  Medically Fragile Infants and Children Day Care,MARLTON,NJ
1750596268,COMMUNITY SCHOOL OF CLEBURNE COUNTY,NPI-2,Day Training  Developmentally Disabled Services,HEBER SPRINGS,AR
1750697801,CROSS COUNTRY STAFFING  INC.,NPI-2,In Home Supportive Care,HIALEAH,FL
1750802401,HDA NY LLC,NPI-2,Home Health,BROOKLYN,NY
1750829362,MARYLAND MEDICAL DAY SERVICES  LLC,NPI-2,Clinic/Center  Adult Day Care,BALTIMORE,MD
1750962049,JARHER INCORPORATED,NPI-2,Clinic/Center  Adult Day Care,ROCKVILLE,MD
1750969168,UPPER MATTAPONI INDIAN TRIBE,NPI-2,Family Medicine,AYLETT,VA
1750987053,TOTAL LONGTERM CARE  INC.,NPI-2,PACE Provider Organization,AURORA,CO
1760056022,CONFEDERATED TRIBES OF THE COLVILLE RESERVATION,NPI-2,Substance Abuse Rehabilitation Facility,KELLER,WA
1760480503,PHOENIX CHILDREN'S HOSPITAL,NPI-2,General Acute Care Hospital  Children,PHOENIX,AZ
1760568877,CAREY COUNSELING CENTER  INC.,NPI-2,Counselor  Mental Health,PARIS,TN
1760590962,FLORIDA CANCER SPECIALISTS & RESEARCH INSTITUTE  LLC,NPI-2,Internal Medicine  Medical Oncology,CAPE CORAL,FL
1760721393,RAYIM OF HUDSON VALLEY  INC.,NPI-2,Early Intervention Provider Agency,MONROE,NY
1760735260,INDEPENDENT COMMUNITY LIVING,NPI-2,Home Health,SANFORD,MI
1760927123,ADVANCE COMMUNITY SERVICES CORP,NPI-2,Speech-Language Pathologist   ,MIAMI,FL
1770022691,A & J STAFFING  INC,NPI-2,Home Health,BROOKLYN,NY
1770513145,AMERICARE CERTIFIED SPECIAL SERVICES  INC.,NPI-2,Home Health,BROOKLYN,NY
1770538001,COUNTY OF FRESNO,NPI-2,Clinic/Center  Mental Health (Including Community Mental Health Center),FRESNO,CA
1770538068,CNS HEALTHCARE,NPI-2,Psychiatry & Neurology  Psychiatry,NOVI,MI
1770573586,MCALLEN HOSPITALS L P,NPI-2,General Acute Care Hospital,EDINBURG,TX
1770669038,MJHS HOSPICE AND PALLIATIVE CARE INC.,NPI-2,Hospice Care  Community Based,NEW YORK,NY
1770696643,HARTFORD HOSPITAL,NPI-2,General Acute Care Hospital,HARTFORD,CT
1770700221,HOWARD CENTER INC,NPI-2,Day Training  Developmentally Disabled Services,BURLINGTON,VT
1770795536,MISSISSIPPI DEPARTMENT OF REHABILITAION SVS,NPI-2,Case Management,JACKSON,MS
1770954281,SPORTS AND PAIN INTERVENTIONS PSC,NPI-2,Clinic/Center  Pain,HORMIGUEROS,PR
1770972853,PEDIATRIC SERVICES OF AMERICA  LLC,NPI-2,Home Health,PLYMOUTH,MA
1780045542,NV ST DV MH DS DESERT DEV CENTER,NPI-2,Respite Care  Respite Care  Intellectual and/or Developmental Disabilities  Child,LAS VEGAS,NV
1780286781,PREMIER HEALTHCARE SERVICES  LLC,NPI-2,In Home Supportive Care,GRAND JUNCTION,CO
1780630608,RECTOR & VISITORS OF THE UNIVERSITY OF VIRGINIA,NPI-2,General Acute Care Hospital,CHARLOTTESVILLE,VA
1780639971,DHHS  PHS  NAIHS  SHIPROCK HOSPITAL,NPI-2,General Acute Care Hospital,SHIPROCK,NM
1780708263,NORTHWESTERN COUNSELING & SUPPORT SERVICES,NPI-2,Community/Behavioral Health,SAINT ALBANS,VT
1780711291,AUTISM SERVICE CENTER,NPI-2,Clinic/Center  Developmental Disabilities,HUNTINGTON,WV
1780721878,WILCARE DALLAS  INC.,NPI-2,Technician  Personal Care Attendant,ARLINGTON,TX
1780791467,RIVERSIDE COMMUNITY CARE  INC.,NPI-2,Community/Behavioral Health,NORWOOD,MA
1780801837,HANDICAP FACILITIES OF ST CHARLES COUNTY,NPI-2,Case Management,ST PETERS,MO
1780816991,NAE EDISON LLC,NPI-2,Home Health,BROOKLYN,NY
1780830034,MERAKEY PENNSYLVANIA,NPI-2,Community/Behavioral Health,MOUNT POCONO,PA
1780913392,EDWARDS HEALTH CARE SERVICES  INC.,NPI-2,Durable Medical Equipment & Medical Supplies,MOREHEAD CITY,NC
1790129757,KIDSPLACE LEARNING CENTER DBA KIDSPOT,NPI-2,Speech-Language Pathologist   ,JONESBORO,AR
1790177582,ALTAMED HEALTH SERVICES CORP,NPI-2,Clinic/Center  Federally Qualified Health Center (FQHC),HUNTINGTON PARK,CA
1790242055,TRI-STATE ADDICTION RECOVERY RESOURCES,NPI-2,Community/Behavioral Health,HUNTINGTON,WV
1790348670,BURTON CENTER,NPI-2,Community Based Residential Treatment Facility  Intellectual and/or Developmental Disabilities,GREENWOOD,SC
1790386746,MVML  INC.,NPI-2,Clinical Medical Laboratory,ORANGE,CA
1790411825,TRUE ANSWER COMMUNITY WELLNESS LLC,NPI-2,Community/Behavioral Health,GLENDALE,AZ
1790432979,THINKING LEARNING TOGETHER 2 LLC,NPI-2,Clinical Nurse Specialist  Psych/Mental Health,PHOENIX,AZ
1790717650,BRIGHAM & WOMENS HOSPITAL  INC.,NPI-2,General Acute Care Hospital,BOSTON,MA
1790730281,COMMUNITY CLINIC  INC.,NPI-2,Clinic/Center  Federally Qualified Health Center (FQHC),TAKOMA PARK,MD
1790778660,COLUSA INDIAN COMMUNITY COUNCIL,NPI-2,Clinic/Center  Federally Qualified Health Center (FQHC),COLUSA,CA
1790826600,STILLAGUAMISH TRIBE OF INDIANS,NPI-2,Clinic/Center  Rehabilitation  Substance Use Disorder,ARLINGTON,WA
1790835296,BEACON SPECIALIZED LIVING SERVICES  INC.,NPI-2,Residential Treatment Facility  Intellectual and/or Developmental Disabilities,BANGOR,MI
1790908002,DEPARTMENT OF DEVELOPMENTAL SERVICES,NPI-2,Case Management,HOLYOKE,MA
1790994952,STELLA ORTON HOME CARE AGENCY  INC.,NPI-2,Home Health,STATEN ISLAND,NY
1801027404,CONSUMER DIRECTED SERVICES IN TEXAS  INC.,NPI-2,Supports Brokerage,SAN ANTONIO,TX
1801060363,HOME FAMILY CARE  INC,NPI-2,Home Health,BROOKLYN,NY
1801131289,RES-CARE NEW JERSEY  INC.,NPI-2,Day Training  Developmentally Disabled Services,MOUNT LAUREL,NJ
1801138698,YEHOWA MEDICAL SERVICES,NPI-2,Clinic/Center  Federally Qualified Health Center (FQHC),SOUTH GATE,CA
1801332861,ALWAYS BEST CARE OF DELAWARE,NPI-2,Home Health,WILMINGTON,DE
1801356787,BM BEHAVIORAL CENTER  LLC,NPI-2,Home Health,SAN PABLO,CA
1801463823,USRC KAPAHULU  LLC,NPI-2,Clinic/Center  End-Stage Renal Disease (ESRD) Treatment,HONOLULU,HI
1801496054,RYSE THERAPEUTIC COUNSELING LLC,NPI-2,Counselor  Mental Health,MESA,AZ
1801569728,ADVENTIST HEALTH SYSTEM-SUNBELT  INC,NPI-2,Clinical Medical Laboratory,ORLANDO,FL
1801803903,NEW YORK CITY HEALTH AND HOSPITALS CORPORATION,NPI-2,General Acute Care Hospital,JAMAICA,NY
1801847066,SAMARITAN PACIFIC HEALTH SERVICES  INC,NPI-2,General Acute Care Hospital  Critical Access,NEWPORT,OR
1801878350,UNITED HEALTH CENTERS OF THE SJV,NPI-2,Clinic/Center  Federally Qualified Health Center (FQHC),PARLIER,CA
1801883707,NEWTOWN DIALYSIS CENTER  INC,NPI-2,Clinic/Center  End-Stage Renal Disease (ESRD) Treatment,ELMHURST,NY
1801922620,LAKE CUMBERLAND REG MHMR BOARD  INC.,NPI-2,Community/Behavioral Health,SOMERSET,KY
1801954474,ERIC LUND,NPI-1,Psychologist  Clinical,GREEN BAY,WI
1811017155,CHILDRENS HOME SOCIETY OF SOUTH DAKOTA,NPI-2,Residential Treatment Facility  Emotionally Disturbed Children,SIOUX FALLS,SD
1811018898,PYRAMID HEALTHCARE,NPI-2,Substance Abuse Rehabilitation Facility,BELLEVILLE,PA
1811024367,GREATER LYNN SENIOR SERVICES INC,NPI-2,Case Management,LYNN,MA
1811073059,INTENSIVE TREATMENT SYSTEMS LLC,NPI-2,Community/Behavioral Health,PHOENIX,AZ
1811130685,SPURWINK SERVICES,NPI-2,Community Based Residential Treatment Facility  Intellectual and/or Developmental Disabilities,LIMERICK,ME
1811178825,THE LAKES COMMUNITY HEALTH CENTER  INC,NPI-2,Clinic/Center  Federally Qualified Health Center (FQHC),IRON RIVER,WI
1811253602,TRI VALLEY CARE  INC,NPI-2,Community/Behavioral Health,HARAHAN,LA
1811301773,ADVANCED HOME CARE SERVICES  INC.,NPI-2,Home Health,BROOKLYN,NY
1811406135,TOWNSEND RECOVERY CENTER NEW ORLEANS  LLC,NPI-2,Substance Abuse Rehabilitation Facility,COVINGTON,LA
1811652381,US MEDICAL LABS INC,NPI-2,Clinical Medical Laboratory,LOMBARD,IL
1811973100,OCHSNER CLINIC FOUNDATION,NPI-2,General Acute Care Hospital,NEW ORLEANS,LA
1811983752,FLORIDA EMERGENCY PHYSICIANS KANG AND ASSOCIATES MD LLC,NPI-2,Emergency Medicine  Emergency Medical Services,ORLANDO,FL
1821032913,NEW VISTA OF THE BLUEGRASS INC,NPI-2,Clinic/Center  Mental Health (Including Community Mental Health Center),VERSAILLES,KY
1821170044,SOUTH COUNTY COMMUNITY HEALTH CENTER INC,NPI-2,Clinic/Center  Primary Care,EAST PALO ALTO,CA
1821201278,TANANA CHIEFS CONFERENCE,NPI-2,Clinic/Center  Multi-Specialty,FAIRBANKS,AK
1821206228,WEST VIRGINIA'S CHOICE,NPI-2,Home Health,MORGANTOWN,WV
1821210402,CROWN HEIGHTS MEDICAL  P.C.,NPI-2,Clinic/Center  Multi-Specialty,MONSEY,NY
1821275801,THE ROYAL CARE INC,NPI-2,Home Health,BROOKLYN,NY
1821323940,THE FOGARTY CENTER,NPI-2,In Home Supportive Care,BARRINGTON,RI
1821341298,COUNTY OF SANTA CLARA,NPI-2,Clinic/Center  Emergency Care,SAN JOSE,CA
1821482860,SPECIALITY SCREENING LLC,NPI-2,Clinical Medical Laboratory,WAUWATOSA,WI
1821502139,IQ BUSINESS CONNECTION,NPI-2,Taxi,SAN JOSE,CA
1821722778,MIREILLE WELLNESS CLINIC,NPI-2,Clinic/Center  Mental Health (Including Community Mental Health Center),PHOENIX,AZ
1831149624,ULTIMATE HOME HEALTHCARE SERVICES  INC.,NPI-2,Home Health,REYNOLDSBURG,OH
1831236009,DEVELOPMENTAL DISABILITIES CENTER,NPI-2,Day Training  Developmentally Disabled Services,LAFAYETTE,CO
1831265115,CLINICAL & SUPPORT OPTIONS  INC,NPI-2,Community/Behavioral Health,GREENFIELD,MA
1831278688,ALL VALLEY HOME HEALTH CARE & NURSING INC,NPI-2,Home Health,PHOENIX,AZ
1831300946,SANTA BARBARA COUNTY DEPARTMENT OF BEHAVIORAL WELLNESS,NPI-2,Psychiatric Unit,SANTA BARBARA,CA
1831361773,ALABAMA DEPARTMENT OF YOUTH SERVICES,NPI-2,Community/Behavioral Health,MOUNT MEIGS,AL
1831377407,VERTEX LLC,NPI-2,Clinic/Center  Rehabilitation  Substance Use Disorder,BRONX,NY
1831449370,CLARK COUNTY DEPARTMENT OF FAMILY SERVICES,NPI-2,Case Management,LAS VEGAS,NV
